[
   {
      "title": "Epic Coupon | Get a 25% Discount",
      "image": "https://cdn1.epicgames.com/salesEvent/salesEvent/EN-Epic-Coupon-foundation-team-image_1920x1079-d0aa1594942034ce8e84d023c53e2fb5",
      "url": "https://bit.ly/3PAn1HO",
      "store": "Epic Games",
      "price": 14.99,
      "date": "15-06-2023",
      "status": 1,
      "horizontal": "fechasProgramadas",
      "startDate": "2023-05-18T15:00:00.000Z",
      "endDate": "2023-06-15T15:00:00.000Z",
      "id": "",
      "store2": "",
      "url2": "",
      "store3": "",
      "url3": "",
      "specialCode": "",
      "information": "",
      "instructions": ""
   },
   {
      "title": "Fidel Dungeon Rescue",
      "image": "https://cdn.cloudflare.steamstatic.com/steam/apps/573170/header.jpg?t=1607725858",
      "url": "https://bit.ly/439t5No",
      "store": "itch.io",
      "price": 8.00,
      "date": "??-05-2023",
      "status": 1,
      "horizontal": true,
      "startDate": "2023-05-06T15:00:00.000Z",
      "endDate": "2023-07-17T15:00:00.000Z",
      "id": "",
      "store2": "",
      "url2": "",
      "store3": "",
      "url3": "",
      "specialCode": "",
      "information": "",
      "instructions": ""
   },
   {
      "title": "Particula",
      "image": "https://www.indiegalacdn.com/imgs/devs/freebies/products/a2ca19fd-bc42-423e-9a2a-75796c77e2eb/prodmain/1684568045.png",
      "url": "https://bit.ly/3WtL5A8",
      "store": "IndieGala",
      "price": 0.00,
      "date": "??-05-2023",
      "status": 1,
      "horizontal": true,
      "startDate": "2023-05-06T15:00:00.000Z",
      "endDate": "2023-07-17T15:00:00.000Z",
      "id": "",
      "store2": "",
      "url2": "",
      "store3": "",
      "url3": "",
      "specialCode": "",
      "information": "",
      "instructions": ""
   },
   {
      "title": "DEATH STRANDING",
      "image": "https://cdn1.epicgames.com/f4a904fcef2447439c35c4e6457f3027/offer/DS_wide-2560x1440-c3d7bbf8ee36dd025610088381a5235a.jpg",
      "url": "https://bit.ly/3jrlp7F",
      "store": "Epic Games",
      "price": 5.00,
      "date": "25-05-2023",
      "status": 1,
      "horizontal": "fechasProgramadas",
      "startDate": "2023-05-18T15:00:00.000Z",
      "endDate": "2023-05-25T15:00:00.000Z",
      "id": "",
      "store2": "",
      "url2": "",
      "store3": "",
      "url3": "",
      "specialCode": "",
      "information": "",
      "instructions": ""
   },
   {
      "title": "MISTERY GAME",
      "image": "https://cdn1.epicgames.com/offer/d5241c76f178492ea1540fce45616757/EN-mega-sale-vault-16x9-asset_1920x1080-a27cf3919dde320a72936374a1d47813?h=480&quality=medium&resize=1&w=854",
      "url": "https://bit.ly/3suSxx3",
      "store": "Epic Games",
      "price": 5.00,
      "date": "25-05-2023",
      "status": 3,
      "horizontal": "fechasProgramadas",
      "startDate": "2023-05-25T15:00:00.000Z",
      "endDate": "2023-06-01T15:00:00.000Z",
      "id": "",
      "store2": "",
      "url2": "",
      "store3": "",
      "url3": "",
      "specialCode": "",
      "information": "",
      "instructions": ""
   },
   {
      "id": "//?SUB SCREEN////",
      "horizontal": "RateUs",
      "image": "",
      "url": "https://www.google.com",
      "title": "RATEUS",
      "store": "",
      "price": 0.00,
      "date": "??-08-2022",
      "status": 1,
      "store2": "",
      "url2": "",
      "store3": "",
      "url3": "",
      "specialCode": "",
      "information": "",
      "instructions": "",
      "startDate": "",
      "endDate": ""
   },
   {
      "id": "//?SUB SCREEN////",
      "horizontal": false,
      "image": "https://cdn2.unrealengine.com/c4-s2-battle-pass-1920x1080-603842488c24.jpg?h=270&quality=medium&resize=1&w=480",
      "url": "https://www.google.com",
      "title": "Fortnite",
      "store": "",
      "price": 0.00,
      "date": "??-08-2022",
      "status": 1,
      "store2": "",
      "url2": "",
      "store3": "",
      "url3": "",
      "specialCode": "",
      "information": "",
      "instructions": "",
      "startDate": "",
      "endDate": ""
   },
   {
      "title": "Metro: Last Light Complete Edition",
      "image": "https://cdn.cloudflare.steamstatic.com/steam/apps/43160/header.jpg?t=1684430351",
      "url": "https://bit.ly/3Io1mRe",
      "store": "Steam",
      "price": 15.00,
      "date": "25-05-2023",
      "status": 1,
      "horizontal": true,
      "startDate": "2023-05-17T19:00:00.000Z",
      "endDate": "2023-05-25T17:00:00.000Z",
      "id": "",
      "store2": "",
      "url2": "",
      "store3": "",
      "url3": "",
      "specialCode": "",
      "information": "",
      "instructions": ""
   },
   {
      "title": "Fiendish Freddy's Big Top o' Fun",
      "image": "https://cdn.cloudflare.steamstatic.com/steam/apps/2256430/header.jpg?t=1679600483",
      "url": "https://bit.ly/3oirxC0",
      "store": "GoG",
      "price": 4.00,
      "date": "22-05-2023",
      "status": 1,
      "horizontal": "fechasProgramadas",
      "startDate": "2023-05-15T19:00:00.000Z",
      "endDate": "2023-05-22T14:00:00.000Z",
      "id": "",
      "store2": "",
      "url2": "",
      "store3": "",
      "url3": "",
      "specialCode": "",
      "information": "",
      "instructions": ""
   },
   {
      "title": "Coldest Circles Quest Pack",
      "image": "https://cdn1.epicgames.com/offer/fn/EN_24BR_ColdestCircles_RMT_EGS_2560x1440_2560x1440-e582f5ce7f084191be6430b2948ae766",
      "url": "https://bit.ly/3IqUW3V",
      "store": "Epic Games",
      "price": 0.00,
      "date": "15-06-2023",
      "status": 1,
      "horizontal": "fechasProgramadas",
      "startDate": "2023-05-18T15:00:00.000Z",
      "endDate": "2023-06-15T15:00:00.000Z",
      "id": "",
      "store2": "",
      "url2": "",
      "store3": "",
      "url3": "",
      "specialCode": "",
      "information": "",
      "instructions": ""
   },
   {
      "title": "Steam free daily sticker",
      "image": "https://i.ytimg.com/vi/ug6gAP8EdjI/maxresdefault.jpg",
      "url": "https://bit.ly/3OgD6Er",
      "store": "Steam",
      "price": 0.00,
      "date": "22-05-2023",
      "status": 1,
      "horizontal": true,
      "startDate": "2023-05-16T19:00:00.000Z",
      "endDate": "2023-05-22T17:00:00.000Z",
      "id": "",
      "store2": "",
      "url2": "",
      "store3": "",
      "url3": "",
      "specialCode": "",
      "information": "",
      "instructions": ""
   },
   {
      "title": "Sherwood Extreme",
      "image": "https://cdn.cloudflare.steamstatic.com/steam/apps/1340180/header.jpg?t=1668383035",
      "url": "https://bit.ly/42Mx8zB",
      "store": "Steam",
      "price": 15.00,
      "date": "??-??-2023",
      "status": 1,
      "horizontal": true,
      "startDate": "2023-05-16T19:00:00.000Z",
      "endDate": "2023-06-03T14:00:00.000Z",
      "id": "",
      "store2": "",
      "url2": "",
      "store3": "",
      "url3": "",
      "specialCode": "",
      "information": "",
      "instructions": ""
   },
   {
      "title": "Bloody Hell",
      "image": "https://cdn.cloudflare.steamstatic.com/steam/apps/2056220/header.jpg?t=1675368434",
      "url": "https://bit.ly/3pNGJri",
      "store": "GoG",
      "price": 0.00,
      "date": "??-06-2023",
      "status": 1,
      "horizontal": "fechasProgramadas",
      "startDate": "2023-05-15T19:00:00.000Z",
      "endDate": "2023-06-03T14:00:00.000Z",
      "id": "",
      "store2": "",
      "url2": "",
      "store3": "",
      "url3": "",
      "specialCode": "",
      "information": "",
      "instructions": ""
   },
   {
      "title": "The Sims™ 4 The Daring Lifestyle Bundle",
      "image": "https://cdn1.epicgames.com/offer/2a14cf8a83b149919a2399504e5686a6/EGS_TheSims4TheDaringLifestyleBundle_Maxis_Bundles_S1_2560x1440-1e11cf4a08a3fbc87660e4867c74d016?h=270&quality=medium&resize=1&w=480",
      "url": "https://bit.ly/3HG9RGK",
      "store": "Epic Games",
      "price": 5.00,
      "date": "18-05-2023",
      "status": 1,
      "horizontal": "fechasProgramadas",
      "startDate": "2023-05-11T15:00:00.000Z",
      "endDate": "2023-05-18T15:00:00.000Z",
      "id": "",
      "store2": "",
      "url2": "",
      "store3": "",
      "url3": "",
      "specialCode": "",
      "information": "",
      "instructions": ""
   },
   {
      "title": "Hotshot Racing - Steam Key",
      "image": "https://fanatical.imgix.net/product/original/55adbeda-cd49-443b-ac5c-c25aa99a5a3a.jpeg?auto=compress,format&w=450&fit=crop&h=253",
      "url": "https://bit.ly/3nVXdNd",
      "store": "Fanatical",
      "price": 0.00,
      "date": "??-05-2023",
      "status": 1,
      "horizontal": true,
      "startDate": "2023-05-06T15:00:00.000Z",
      "endDate": "2023-07-17T15:00:00.000Z",
      "id": "",
      "store2": "",
      "url2": "",
      "store3": "",
      "url3": "",
      "specialCode": "",
      "information": "",
      "instructions": ""
   },
   {
      "title": "DiRT Rally 2.0 - Sweden (Rally Location)",
      "image": "https://cdn.cloudflare.steamstatic.com/steam/apps/1004891/header.jpg?t=1683139058",
      "url": "https://bit.ly/3W6iPTL",
      "store": "Steam",
      "price": 2.50,
      "date": "29-05-2023",
      "status": 1,
      "horizontal": "fechasProgramadas",
      "startDate": "2023-05-15T15:00:00.000Z",
      "endDate": "2023-05-29T17:00:00.000Z",
      "id": "",
      "store2": "",
      "url2": "",
      "store3": "",
      "url3": "",
      "specialCode": "",
      "information": "",
      "instructions": ""
   },
   {
      "title": "DiRT Rally 2.0 - Finland (Rally Location)",
      "image": "https://cdn.cloudflare.steamstatic.com/steam/apps/1118292/header.jpg?t=1683138914",
      "url": "https://bit.ly/3M9bYEr",
      "store": "Steam",
      "price": 2.50,
      "date": "29-05-2023",
      "status": 1,
      "horizontal": "fechasProgramadas",
      "startDate": "2023-05-15T15:00:00.000Z",
      "endDate": "2023-05-29T17:00:00.000Z",
      "id": "",
      "store2": "",
      "url2": "",
      "store3": "",
      "url3": "",
      "specialCode": "",
      "information": "",
      "instructions": ""
   },
   {
      "title": "DiRT Rally 2.0 - Germany (Rally Location)",
      "image": "https://cdn.cloudflare.steamstatic.com/steam/apps/1004892/header.jpg?t=1683138978",
      "url": "https://bit.ly/451pSRT",
      "store": "Steam",
      "price": 2.50,
      "date": "29-05-2023",
      "status": 1,
      "horizontal": "fechasProgramadas",
      "startDate": "2023-05-15T15:00:00.000Z",
      "endDate": "2023-05-29T17:00:00.000Z",
      "id": "",
      "store2": "",
      "url2": "",
      "store3": "",
      "url3": "",
      "specialCode": "",
      "information": "",
      "instructions": ""
   },
   {
      "title": "DiRT Rally 2.0 - Wales (Rally Location)",
      "image": "https://cdn.cloudflare.steamstatic.com/steam/apps/1004894/header.jpg?t=1683138947",
      "url": "https://bit.ly/3IB0itx",
      "store": "Steam",
      "price": 2.50,
      "date": "29-05-2023",
      "status": 1,
      "horizontal": "fechasProgramadas",
      "startDate": "2023-05-15T15:00:00.000Z",
      "endDate": "2023-05-29T17:00:00.000Z",
      "id": "",
      "store2": "",
      "url2": "",
      "store3": "",
      "url3": "",
      "specialCode": "",
      "information": "",
      "instructions": ""
   },
   {
      "title": "Overcast - Walden and the Werewolf",
      "image": "https://www.indiegalacdn.com/imgs/devs/freebies/products/921b193d-0cc3-4229-afc2-8d4bff471f6e/prodmain/1683975292.png",
      "url": "https://bit.ly/3Mm5Wlo",
      "store": "IndieGala",
      "price": 0.00,
      "date": "??-05-2023",
      "status": 1,
      "horizontal": true,
      "startDate": "2023-05-06T15:00:00.000Z",
      "endDate": "2023-07-17T15:00:00.000Z",
      "id": "",
      "store2": "",
      "url2": "",
      "store3": "",
      "url3": "",
      "specialCode": "",
      "information": "",
      "instructions": ""
   },
   {
      "title": "HotFloor",
      "image": "https://www.indiegalacdn.com/imgs/devs/freebies/products/44241a1c-2c32-4fa1-9c8b-46d8078b5212/prodmain/1683797175.png",
      "url": "https://bit.ly/3HYwg2w",
      "store": "IndieGala",
      "price": 0.00,
      "date": "??-05-2023",
      "status": 1,
      "horizontal": true,
      "startDate": "2023-05-06T15:00:00.000Z",
      "endDate": "2023-07-17T15:00:00.000Z",
      "id": "",
      "store2": "",
      "url2": "",
      "store3": "",
      "url3": "",
      "specialCode": "",
      "information": "",
      "instructions": ""
   },
   {
      "title": "Thief Simulator 2: Prologue",
      "image": "https://cdn.akamai.steamstatic.com/steam/apps/2272420/header.jpg?t=1683227963",
      "url": "https://bit.ly/3M1wjNc",
      "store": "Steam",
      "price": 0.00,
      "date": "19-07-2023",
      "status": 1,
      "horizontal": "fechasProgramadas",
      "startDate": "2023-05-06T15:00:00.000Z",
      "endDate": "2023-07-19T15:00:00.000Z",
      "id": "",
      "store2": "",
      "url2": "",
      "store3": "",
      "url3": "",
      "specialCode": "",
      "information": "",
      "instructions": ""
   },
   {
      "title": "HUMANKIND™ - Para Bellum Wonders Pack",
      "image": "https://cdn.akamai.steamstatic.com/steam/apps/2320210/header.jpg?t=1682520777",
      "url": "https://bit.ly/3Ayif7k",
      "store": "Steam",
      "price": 2.00,
      "date": "10-05-2023",
      "status": 1,
      "horizontal": "fechasProgramadas",
      "startDate": "2023-04-25T15:00:00.000Z",
      "endDate": "2023-05-10T17:00:00.000Z",
      "id": "",
      "store2": "",
      "url2": "",
      "store3": "",
      "url3": "",
      "specialCode": "",
      "information": "",
      "instructions": ""
   },
   {
      "title": "The Oregon Trail — Cowboys and Critters DLC",
      "image": "https://cdn.akamai.steamstatic.com/steam/apps/2316610/header_spanish.jpg?t=1682423731",
      "url": "https://bit.ly/41Hj7CK",
      "store": "Steam",
      "price": 0.00,
      "date": "08-05-2023",
      "status": 1,
      "horizontal": "fechasProgramadas",
      "startDate": "2023-04-20T15:00:00.000Z",
      "endDate": "2023-05-08T17:00:00.000Z",
      "id": "",
      "store2": "",
      "url2": "",
      "store3": "",
      "url3": "",
      "specialCode": "",
      "information": "",
      "instructions": ""
   },
   {
      "title": "FINAL FANTASY XIV: Stormblood",
      "image": "https://cdn.cloudflare.steamstatic.com/steam/apps/582380/header.jpg?t=1679936405",
      "url": "https://bit.ly/3M0CC3Y",
      "store": "Steam",
      "price": 5.00,
      "date": "08-05-2023",
      "status": 1,
      "horizontal": "fechasProgramadas",
      "startDate": "2023-03-28T15:00:00.000Z",
      "endDate": "2023-05-08T14:00:00.000Z",
      "id": "",
      "store2": "",
      "url2": "",
      "store3": "",
      "url3": "",
      "specialCode": "",
      "information": "",
      "instructions": ""
   },
   {
      "title": "bio evil 4",
      "image": "https://static.promodescuentos.com/threads/raw/IckB6/838622_1/re/768x768/qt/60/838622_1.jpg",
      "url": "https://bit.ly/3UmIxCI",
      "store": "itch.io",
      "price": 0.00,
      "date": "2023",
      "status": 1,
      "horizontal": true,
      "startDate": "2023-04-05T16:00:00.000Z",
      "endDate": "2023-04-09T16:00:00.000Z",
      "id": "",
      "store2": "",
      "url2": "",
      "store3": "",
      "url3": "",
      "specialCode": "",
      "information": "",
      "instructions": ""
   },
   {
      "title": "The Murder of Sonic the Hedgehog",
      "image": "https://cdn.cloudflare.steamstatic.com/steam/apps/2324650/header.jpg?t=1680289478",
      "url": "https://bit.ly/40uKqzF",
      "store": "Steam",
      "price": 0.00,
      "date": "31-03-2023",
      "status": 1,
      "horizontal": true,
      "startDate": "2023-03-30T15:00:00.000Z",
      "endDate": "2023-04-06T15:00:00.000Z",
      "id": "",
      "store2": "",
      "url2": "",
      "store3": "",
      "url3": "",
      "specialCode": "",
      "information": "",
      "instructions": ""
   },
   {
      "title": "Valiant Hearts: Coming Home",
      "image": "https://staticctf.akamaized.net/J3yJr34U2pZ2Ieem48Dwy9uqj5PNUQTn/2u4YSAoroHCZ3oRMjLOrOA/41acc6ffab721ba35bdcb4e68b9517fa/VH_CH_960x540.jpg",
      "url": "https://bit.ly/3XWLmve",
      "store": "Google Play",
      "price": 5.00,
      "date": "??-??-2023",
      "status": 1,
      "horizontal": true,
      "startDate": "2022-12-19T19:00:00.000Z",
      "endDate": "2024-12-19T16:00:00.000Z",
      "id": "",
      "store2": "",
      "url2": "",
      "store3": "",
      "url3": "",
      "specialCode": "",
      "information": "",
      "instructions": ""
   },
   {
      "title": "PUBG Founder's Pack",
      "image": "https://cdn1.epicgames.com/spt-assets/53ec4985296b4facbe3a8d8d019afba9/pubg-battlegrounds-1hfa6.jpg?h=270&resize=1&w=480",
      "url": "https://bit.ly/3VCoXCi",
      "store": "Epic Games",
      "price": 5.00,
      "date": "2023",
      "id": "",
      "horizontal": true,
      "status": 1,
      "store2": "",
      "url2": "",
      "store3": "",
      "url3": "",
      "specialCode": "",
      "information": "",
      "instructions": "",
      "startDate": "",
      "endDate": ""
   },
   {
      "title": "Die Young: Prologue",
      "image": "https://www.indiegalacdn.com/imgs/devs/freebies/products/6ba4b90d-ec12-4343-bd6f-415f0881ebae/prodmain/1574430858.png",
      "url": "https://bit.ly/395O0do",
      "store": "IndieGala",
      "price": 5.00,
      "date": "??-03-2023",
      "id": "",
      "horizontal": true,
      "status": 1,
      "store2": "",
      "url2": "",
      "store3": "",
      "url3": "",
      "specialCode": "",
      "information": "",
      "instructions": "",
      "startDate": "",
      "endDate": ""
   },
   {
      "title": "Ghost of Tomorrow",
      "image": "https://img.itch.zone/aW1nLzMzNDU4NDQucG5n/original/IhzTC%2B.png",
      "url": "https://bit.ly/3WgTFBK",
      "store": "itch.io",
      "price": 5.00,
      "date": "??-03-2023",
      "id": "",
      "horizontal": true,
      "status": 1,
      "store2": "",
      "url2": "",
      "store3": "",
      "url3": "",
      "specialCode": "",
      "information": "",
      "instructions": "",
      "startDate": "",
      "endDate": ""
   },
   {
      "title": "REDES SOCIALES",
      "image": "",
      "url": "",
      "store": "",
      "price": 0.00,
      "date": "13-03-2023",
      "id": "",
      "horizontal": "social",
      "status": 1
   },
   {
      "id": "//?SUB SCREEN////",
      "horizontal": false,
      "title": "Diablo Immortal",
      "image": "https://blz-contentstack-images.akamaized.net/v3/assets/blt77f4425de611b362/blt0b41183f11404532/61660a3ace267e66ae2fe854/di-opengraph_001.jpg",
      "url": "https://www.google.com",
      "store": "",
      "price": 0.00,
      "date": "??-08-2022",
      "status": 4,
      "store2": "",
      "url2": "",
      "store3": "",
      "url3": "",
      "specialCode": "",
      "information": "",
      "instructions": "",
      "startDate": "",
      "endDate": ""
   },
   {
      "id": "//?SUB SCREEN//",
      "horizontal": false,
      "title": "Poppy Playtime",
      "image": "https://cdn.akamai.steamstatic.com/steam/apps/1721470/capsule_616x353.jpg?t=1641425530",
      "url": "https://www.google.com",
      "store": "",
      "price": 0.00,
      "date": "??-08-2022",
      "status": 3,
      "store2": "",
      "url2": "",
      "store3": "",
      "url3": "",
      "specialCode": "",
      "information": "",
      "instructions": "",
      "startDate": "",
      "endDate": ""
   },
   {
      "title": "Against All Odds",
      "image": "https://cdn.akamai.steamstatic.com/steam/apps/1465560/header.jpg?t=1682463909",
      "url": "https://bit.ly/3VaeRcm",
      "store": "Epic Games",
      "price": 5.00,
      "date": "11-05-2023",
      "status": 2,
      "horizontal": true,
      "startDate": "2023-05-04T15:00:00.000Z",
      "endDate": "2023-05-11T15:00:00.000Z",
      "id": "",
      "store2": "",
      "url2": "",
      "store3": "",
      "url3": "",
      "specialCode": "",
      "information": "",
      "instructions": ""
   },
   {
      "title": "Kao the Kangaroo",
      "image": "https://cdn.akamai.steamstatic.com/steam/apps/1370140/header.jpg?t=1675333487",
      "url": "https://bit.ly/424c7j6",
      "store": "Epic Games",
      "price": 5.00,
      "date": "11-05-2023",
      "status": 2,
      "horizontal": true,
      "startDate": "2023-05-04T15:00:00.000Z",
      "endDate": "2023-05-11T15:00:00.000Z",
      "id": "",
      "store2": "",
      "url2": "",
      "store3": "",
      "url3": "",
      "specialCode": "",
      "information": "",
      "instructions": ""
   },
   {
      "title": "Horizon Chase Turbo",
      "image": "https://cdn.akamai.steamstatic.com/steam/apps/389140/header.jpg?t=1681755206",
      "url": "https://bit.ly/3YscbrT",
      "store": "Epic Games",
      "price": 5.00,
      "date": "11-05-2023",
      "status": 2,
      "horizontal": true,
      "startDate": "2023-05-04T15:00:00.000Z",
      "endDate": "2023-05-11T15:00:00.000Z",
      "id": "",
      "store2": "",
      "url2": "",
      "store3": "",
      "url3": "",
      "specialCode": "",
      "information": "",
      "instructions": ""
   },
   {
      "title": "Breathedge",
      "image": "https://cdn.akamai.steamstatic.com/steam/apps/738520/header.jpg?t=1672158810",
      "url": "https://bit.ly/3UQ9M92",
      "store": "Epic Games",
      "price": 8.00,
      "date": "04-05-2023",
      "status": 2,
      "horizontal": true,
      "startDate": "2023-04-27T15:00:00.000Z",
      "endDate": "2023-05-04T15:00:00.000Z",
      "id": "",
      "store2": "",
      "url2": "",
      "store3": "",
      "url3": "",
      "specialCode": "",
      "information": "",
      "instructions": ""
   },
   {
      "title": "Poker Club",
      "image": "https://cdn.akamai.steamstatic.com/steam/apps/1174460/header.jpg?t=1667318770",
      "url": "https://bit.ly/3N1xRYG",
      "store": "Epic Games",
      "price": 6.00,
      "date": "04-05-2023",
      "status": 2,
      "horizontal": true,
      "startDate": "2023-04-27T15:00:00.000Z",
      "endDate": "2023-05-04T15:00:00.000Z",
      "id": "",
      "store2": "",
      "url2": "",
      "store3": "",
      "url3": "",
      "specialCode": "",
      "information": "",
      "instructions": ""
   },
   {
      "title": "Beyond Blue",
      "image": "https://cdn.cloudflare.steamstatic.com/steam/apps/883360/header.jpg?t=1667256619",
      "url": "https://bit.ly/3KybUgQ",
      "store": "Epic Games",
      "price": 8.00,
      "date": "27-04-2023",
      "status": 2,
      "horizontal": true,
      "startDate": "2023-04-20T15:00:00.000Z",
      "endDate": "2023-04-27T15:00:00.000Z",
      "id": "",
      "store2": "",
      "url2": "",
      "store3": "",
      "url3": "",
      "specialCode": "",
      "information": "",
      "instructions": ""
   },
   {
      "title": "Never Alone (Kisima Ingitchuna)",
      "image": "https://cdn.cloudflare.steamstatic.com/steam/apps/295790/header.jpg?t=1667256530",
      "url": "https://bit.ly/406Fwrv",
      "store": "Epic Games",
      "price": 6.00,
      "date": "27-04-2023",
      "status": 2,
      "horizontal": true,
      "startDate": "2023-04-20T15:00:00.000Z",
      "endDate": "2023-04-27T15:00:00.000Z",
      "id": "",
      "store2": "",
      "url2": "",
      "store3": "",
      "url3": "",
      "specialCode": "",
      "information": "",
      "instructions": ""
   },
   {
      "title": "Second Extinction™",
      "image": "https://cdn.cloudflare.steamstatic.com/steam/apps/1024380/header.jpg?t=1667900501",
      "url": "https://bit.ly/3ZGm0BS",
      "store": "Epic Games",
      "price": 12.00,
      "date": "20-04-2023",
      "status": 2,
      "horizontal": true,
      "startDate": "2023-04-13T15:00:00.000Z",
      "endDate": "2023-04-20T15:00:00.000Z",
      "id": "",
      "store2": "",
      "url2": "",
      "store3": "",
      "url3": "",
      "specialCode": "",
      "information": "",
      "instructions": ""
   },
   {
      "title": "MORDHAU",
      "image": "https://cdn.cloudflare.steamstatic.com/steam/apps/629760/header.jpg?t=1679994491",
      "url": "https://bit.ly/3KEmOmE",
      "store": "Epic Games",
      "price": 5.00,
      "date": "20-04-2023",
      "status": 2,
      "horizontal": true,
      "startDate": "2023-04-13T15:00:00.000Z",
      "endDate": "2023-04-20T15:00:00.000Z",
      "id": "",
      "store2": "",
      "url2": "",
      "store3": "",
      "url3": "",
      "specialCode": "",
      "information": "",
      "instructions": ""
   },
   {
      "title": "Peaky Blinders: Mastermind - Steam Key",
      "image": "https://fanatical.imgix.net/product/original/8567a23e-8cf3-443f-8693-3b777c780bda.jpeg?auto=compress,format&w=450&fit=crop&h=253",
      "url": "https://bit.ly/3ocdQ7q",
      "store": "Fanatical",
      "price": 24.99,
      "date": "26-04-2023",
      "status": 2,
      "horizontal": true,
      "startDate": "2023-04-05T16:00:00.000Z",
      "endDate": "2023-04-09T16:00:00.000Z",
      "id": "",
      "store2": "",
      "url2": "",
      "store3": "",
      "url3": "",
      "specialCode": "",
      "information": "",
      "instructions": ""
   },
   {
      "title": "Dying Light Enhanced Edition",
      "image": "https://images.gog-statics.com/c8bf7ab6961467de104ceacaa45b3ef4cf703791642efd22840b27b0ea60a601.jpg?h=480&quality=medium&resize=1&w=854",
      "url": "https://bit.ly/3K1aZoS",
      "store": "Epic Games",
      "price": 25.00,
      "date": "06-04-2023",
      "status": 2,
      "horizontal": true,
      "startDate": "2023-04-06T15:00:00.000Z",
      "endDate": "2023-04-13T15:00:00.000Z",
      "id": "",
      "store2": "",
      "url2": "",
      "store3": "",
      "url3": "",
      "specialCode": "",
      "information": "",
      "instructions": ""
   },
   {
      "title": "shapez",
      "image": "https://cdn.cloudflare.steamstatic.com/steam/apps/1318690/header.jpg?t=1672994179",
      "url": "https://bit.ly/3GgYBA4",
      "store": "Epic Games",
      "price": 5.00,
      "date": "06-04-2023",
      "status": 2,
      "horizontal": true,
      "startDate": "2023-04-06T15:00:00.000Z",
      "endDate": "2023-04-13T15:00:00.000Z",
      "id": "",
      "store2": "",
      "url2": "",
      "store3": "",
      "url3": "",
      "specialCode": "",
      "information": "",
      "instructions": ""
   },
   {
      "title": "Call of the Sea",
      "image": "https://cdn1.epicgames.com/salesEvent/salesEvent/EGS_CalloftheSea_OutoftheBlue_S1_2560x1440-204699c6410deef9c18be0ee392f8335?h=480&quality=medium&resize=1&w=854",
      "url": "https://bit.ly/3kLa43d",
      "store": "Epic Games",
      "price": 5.00,
      "date": "16-03-2023",
      "status": 2,
      "horizontal": true,
      "startDate": "2023-03-09T16:00:00.000Z",
      "endDate": "2023-03-16T15:00:00.000Z",
      "id": "",
      "store2": "",
      "url2": "",
      "store3": "",
      "url3": "",
      "specialCode": "",
      "information": "",
      "instructions": ""
   },
   {
      "title": "Tunche",
      "image": "https://cdn1.epicgames.com/salesEvent/salesEvent/EGS_Tunche_LeapGameStudios_S1_2560x1440-1f0c9b8e43a9525d762ed823a05f19ca?h=480&quality=medium&resize=1&w=854",
      "url": "https://bit.ly/3Jymm7A",
      "store": "Epic Games",
      "price": 8.00,
      "date": "06-04-2023",
      "status": 2,
      "horizontal": true,
      "startDate": "2023-03-30T15:00:00.000Z",
      "endDate": "2023-04-06T15:00:00.000Z",
      "id": "",
      "store2": "",
      "url2": "",
      "store3": "",
      "url3": "",
      "specialCode": "",
      "information": "",
      "instructions": ""
   },
   {
      "title": "The Silent Age",
      "image": "https://cdn.cloudflare.steamstatic.com/steam/apps/352520/header.jpg?t=1679244381",
      "url": "https://bit.ly/3TT8ucG",
      "store": "Epic Games",
      "price": 5.00,
      "date": "06-04-2023",
      "status": 2,
      "horizontal": true,
      "startDate": "2023-03-30T15:00:00.000Z",
      "endDate": "2023-04-06T15:00:00.000Z",
      "id": "",
      "store2": "",
      "url2": "",
      "store3": "",
      "url3": "",
      "specialCode": "",
      "information": "",
      "instructions": ""
   },
   {
      "title": "Chess Ultra",
      "image": "https://cdn1.epicgames.com/spt-assets/f8581083c427408285529920a8afbdac/chess-ultra-offer-1b0t8.jpg?h=480&quality=medium&resize=1&w=854",
      "url": "https://bit.ly/3yGF2gv",
      "store": "Epic Games",
      "price": 5.00,
      "date": "30-03-2023",
      "status": 2,
      "horizontal": true,
      "startDate": "2023-03-23T15:00:00.000Z",
      "endDate": "2023-03-30T15:00:00.000Z",
      "id": "",
      "store2": "",
      "url2": "",
      "store3": "",
      "url3": "",
      "specialCode": "",
      "information": "",
      "instructions": ""
   },
   {
      "title": "Warhammer 40,000: Gladius - Relics of War",
      "image": "https://cdn1.epicgames.com/0d89655f53884b09b241b60c07e684af/offer/EGS_Warhammer40000GladiusRelicsofWar_ProxyStudios_S1-2560x1440-961653d760b7d41a65a0c268be581870.jpg?h=480&quality=medium&resize=1&w=854",
      "url": "https://bit.ly/41T1kch",
      "store": "Epic Games",
      "price": 15.00,
      "date": "16-03-2023",
      "status": 2,
      "horizontal": true,
      "startDate": "2023-03-16T15:00:00.000Z",
      "endDate": "2023-03-23T15:00:00.000Z",
      "id": "",
      "store2": "",
      "url2": "",
      "store3": "",
      "url3": "",
      "specialCode": "",
      "information": "",
      "instructions": ""
   },
   {
      "title": "Rise of Industry",
      "image": "https://cdn1.epicgames.com/spt-assets/a6aeec29591b4b56b4383b4d2d7d0e1e/rise-of-industry-offer-1p22f.jpg?h=480&quality=medium&resize=1&w=854",
      "url": "https://bit.ly/3IQh5t4",
      "store": "Epic Games",
      "price": 3.50,
      "date": "09-03-2023",
      "status": 2,
      "horizontal": true,
      "startDate": "2023-03-02T16:00:00.000Z",
      "endDate": "2023-03-09T16:00:00.000Z",
      "id": "",
      "store2": "",
      "url2": "",
      "store3": "",
      "url3": "",
      "specialCode": "",
      "information": "",
      "instructions": ""
   },
   {
      "title": "Warpips",
      "image": "https://cdn1.epicgames.com/spt-assets/581b8af82db34e5c98f5dae3ed5b9904/warpips-offer-1pcp0.jpg?h=480&resize=1&w=854",
      "url": "https://bit.ly/3HKcJlr",
      "store": "Epic Games",
      "price": 3.50,
      "date": "23-02-2023",
      "status": 2,
      "horizontal": true,
      "startDate": "2023-02-16T16:00:00.000Z",
      "endDate": "2023-02-23T16:00:00.000Z",
      "id": "",
      "store2": "",
      "url2": "",
      "store3": "",
      "url3": "",
      "specialCode": "",
      "information": "",
      "instructions": ""
   },
   {
      "title": "Recipe for Disaster",
      "image": "https://cdn1.epicgames.com/spt-assets/83ddef361d0c45c2bef72e07c2a5f567/recipe-for-disaster-offer-rtr4w.jpg?h=480&resize=1&w=854",
      "url": "https://bit.ly/3l2KMO6",
      "store": "Epic Games",
      "price": 25.00,
      "date": "16-02-2023",
      "status": 2,
      "horizontal": true,
      "startDate": "2023-02-09T16:00:00.000Z",
      "endDate": "2023-02-16T16:00:00.000Z",
      "id": "",
      "store2": "",
      "url2": "",
      "store3": "",
      "url3": "",
      "specialCode": "",
      "information": "",
      "instructions": ""
   },
   {
      "title": "Dishonored®: Death of the Outsider™",
      "image": "https://cdn.cloudflare.steamstatic.com/steam/apps/614570/header.jpg?t=1603891882",
      "url": "https://bit.ly/3R7nnXD",
      "store": "Epic Games",
      "price": 25.00,
      "date": "02-09-2023",
      "status": 2,
      "horizontal": true,
      "startDate": "2023-02-02T16:00:00.000Z",
      "endDate": "2023-02-09T16:00:00.000Z",
      "id": "",
      "store2": "",
      "url2": "",
      "store3": "",
      "url3": "",
      "specialCode": "",
      "information": "",
      "instructions": ""
   },
   {
      "title": "City of Gangsters",
      "image": "https://cdn.cloudflare.steamstatic.com/steam/apps/1386780/header.jpg?t=1659083418",
      "url": "https://bit.ly/3jcgzLN",
      "store": "Epic Games",
      "price": 12.50,
      "date": "02-09-2023",
      "status": 2,
      "horizontal": true,
      "startDate": "2023-02-02T16:00:00.000Z",
      "endDate": "2023-02-09T16:00:00.000Z",
      "id": "",
      "store2": "",
      "url2": "",
      "store3": "",
      "url3": "",
      "specialCode": "",
      "information": "",
      "instructions": ""
   },
   {
      "title": "Rayman Raving Rabbids",
      "image": "https://cdn.cloudflare.steamstatic.com/steam/apps/15080/header.jpg?t=1624892708",
      "url": "https://bit.ly/3kngXat",
      "store": "Ubisoft Connect",
      "price": 9.99,
      "date": "??-01-2023",
      "status": 2,
      "horizontal": true,
      "startDate": "2023-01-19T19:00:00.000Z",
      "endDate": "2024-02-02T16:00:00.000Z",
      "id": "",
      "store2": "",
      "url2": "",
      "store3": "",
      "url3": "",
      "specialCode": "",
      "information": "",
      "instructions": ""
   },
   {
      "title": "Kerbal Space Program",
      "image": "https://cdn.cloudflare.steamstatic.com/steam/apps/220200/header.jpg?t=1663603925",
      "url": "https://bit.ly/3vnODHd",
      "store": "Epic Games",
      "price": 20.00,
      "date": "12-01-2023",
      "status": 2,
      "horizontal": true,
      "startDate": "2023-01-05T16:00:00.000Z",
      "endDate": "2023-01-12T16:00:00.000Z",
      "id": "",
      "store2": "",
      "url2": "",
      "store3": "",
      "url3": "",
      "specialCode": "",
      "information": "",
      "instructions": ""
   },
   {
      "title": "Dishonored - Definitive Edition",
      "image": "https://cdn1.epicgames.com/offer/d5241c76f178492ea1540fce45616757/15days-day15-Unwrapped-desktop-carousel-image1_1920x1080-1992edb42bb8554ddeb14d430ba3f858?h=480&resize=1&w=854",
      "url": "https://bit.ly/3C8RAPG",
      "store": "Epic Games",
      "price": 16.00,
      "date": "05-01-2023",
      "status": 2,
      "horizontal": true,
      "startDate": "2022-12-29T15:00:00.000Z",
      "endDate": "2023-01-05T16:00:00.000Z",
      "id": "",
      "store2": "",
      "url2": "",
      "store3": "",
      "url3": "",
      "specialCode": "",
      "information": "",
      "instructions": ""
   },
   {
      "title": "Eximius: Seize the Frontline",
      "image": "https://cdn1.epicgames.com/offer/1c943de0163f4f0982f34dc0fc37dce9/EGS_EximiusSeizetheFrontline_AmmoboxStudios_S11_2560x1440-afd78f58327ae2bf5ae3e6f38ea0b6b3?h=480&resize=1&w=854",
      "url": "https://bit.ly/3hZk87v",
      "store": "Epic Games",
      "price": 14.00,
      "date": "05-01-2023",
      "status": 2,
      "horizontal": true,
      "startDate": "2022-12-29T15:00:00.000Z",
      "endDate": "2023-01-05T16:00:00.000Z",
      "id": "",
      "store2": "",
      "url2": "",
      "store3": "",
      "url3": "",
      "specialCode": "",
      "information": "",
      "instructions": ""
   },
   {
      "title": "25% Epic Games Store Holiday Coupon",
      "image": "https://cdn1.epicgames.com/salesEvent/salesEvent/EN_EGS_HolidaySale2020_Main_Coupon_Store_Banner_2560x1440-76eca8f1fa6dd840fa9872c635ba9dc3",
      "url": "https://bit.ly/3j5AUC2",
      "store": "Epic Games",
      "price": 0.00,
      "date": "05-01-2023",
      "id": "",
      "store2": "",
      "url2": "",
      "store3": "",
      "url3": "",
      "specialCode": "",
      "information": "",
      "instructions": "",
      "status": 2,
      "horizontal": true,
      "startDate": "2022-12-15T18:00:00.000Z",
      "endDate": "2023-01-05T16:00:00.000Z"
   },
   {
      "title": "Fall Guys - Invernal",
      "image": "https://cdn1.epicgames.com/offer/50118b7f954e450f8823df1614b24e80/EGS_FallGuysSnowberry_Mediatonic_DLC_G1A_00_1920x1080-ddf550ffed772f8d9f5a5941c92eb73c",
      "url": "https://bit.ly/3WtwMe3",
      "store": "Epic Games",
      "price": 5.00,
      "date": "05-01-2023",
      "status": 2,
      "horizontal": true,
      "startDate": "2022-12-27T23:00:00.000Z",
      "endDate": "2023-01-05T16:00:00.000Z",
      "id": "",
      "store2": "",
      "url2": "",
      "store3": "",
      "url3": "",
      "specialCode": "",
      "information": "",
      "instructions": ""
   },
   {
      "title": "Mortal Shell",
      "image": "https://cdn.cloudflare.steamstatic.com/steam/apps/1110910/header.jpg?t=1668014729",
      "url": "https://bit.ly/3Gh9v8n",
      "store": "Epic Games",
      "price": 20.00,
      "date": "29-12-2022",
      "status": 2,
      "horizontal": true,
      "startDate": "2022-12-28T16:00:00.000Z",
      "endDate": "2022-12-29T16:00:00.000Z",
      "id": "",
      "store2": "",
      "url2": "",
      "store3": "",
      "url3": "",
      "specialCode": "",
      "information": "",
      "instructions": ""
   },
   {
      "title": "DEATH STRANDING",
      "image": "https://cdn1.epicgames.com/f4a904fcef2447439c35c4e6457f3027/offer/DS_wide-2560x1440-c3d7bbf8ee36dd025610088381a5235a.jpg",
      "url": "https://bit.ly/3jrlp7F",
      "store": "Epic Games",
      "price": 60.00,
      "date": "26-12-2022",
      "status": 2,
      "horizontal": true,
      "startDate": "2022-12-25T15:00:00.000Z",
      "endDate": "2022-12-26T16:00:00.000Z",
      "id": "",
      "store2": "",
      "url2": "",
      "store3": "",
      "url3": "",
      "specialCode": "",
      "information": "",
      "instructions": ""
   },
   {
      "title": "Metro: Last Light Redux",
      "image": "https://cdn1.epicgames.com/offer/d5241c76f178492ea1540fce45616757/Copyof15days-day10-wrapped-desktop-carousel-image1_1920x1080-76982d1554e521a9d0900aa59f832644?h=480&resize=1&w=854",
      "url": "https://bit.ly/3G02oRA",
      "store": "Epic Games",
      "price": 10.00,
      "date": "25-12-2022",
      "status": 2,
      "horizontal": true,
      "startDate": "2022-12-24T16:00:00.000Z",
      "endDate": "2022-12-25T16:00:00.000Z",
      "id": "",
      "store2": "",
      "url2": "",
      "store3": "",
      "url3": "",
      "specialCode": "",
      "information": "",
      "instructions": ""
   },
   {
      "title": "Fallout: A Post Nuclear Role Playing Game",
      "image": "https://cdn.cloudflare.steamstatic.com/steam/apps/38400/header.jpg?t=1572025441",
      "url": "https://bit.ly/3WjNEnq",
      "store": "Epic Games",
      "price": 9.00,
      "date": "23-12-2022",
      "status": 2,
      "horizontal": true,
      "startDate": "2022-12-22T16:00:00.000Z",
      "endDate": "2022-12-23T16:00:00.000Z",
      "id": "",
      "store2": "",
      "url2": "",
      "store3": "",
      "url3": "",
      "specialCode": "",
      "information": "",
      "instructions": ""
   },
   {
      "title": "LEGO® Builder's Journey",
      "image": "https://cdn1.epicgames.com/offer/d5241c76f178492ea1540fce45616757/Copyof15days-day7-wrapped-desktop-carousel-image1_1920x1080-b038ba02f28c8155ed78a442b2720f1b?h=480&resize=1&w=854",
      "url": "https://bit.ly/3VaWH8F",
      "store": "Epic Games",
      "price": 8.00,
      "date": "22-12-2022",
      "status": 2,
      "horizontal": true,
      "startDate": "2022-12-21T16:00:00.000Z",
      "endDate": "2022-12-22T16:00:00.000Z",
      "id": "",
      "store2": "",
      "url2": "",
      "store3": "",
      "url3": "",
      "specialCode": "",
      "information": "",
      "instructions": ""
   },
   {
      "title": "Wolfenstein: The New Order",
      "image": "https://cdn.akamai.steamstatic.com/steam/apps/201810/header.jpg?t=1630605243",
      "url": "https://bit.ly/3Q8gk02",
      "store": "Epic Games",
      "price": 18.00,
      "date": "20-12-2022",
      "status": 2,
      "horizontal": true,
      "startDate": "2022-12-20T16:00:00.000Z",
      "endDate": "2022-12-21T16:00:00.000Z",
      "id": "",
      "store2": "",
      "url2": "",
      "store3": "",
      "url3": "",
      "specialCode": "",
      "information": "",
      "instructions": ""
   },
   {
      "title": "Horizon Chase Turbo",
      "image": "https://cdn.akamai.steamstatic.com/steam/apps/389140/header.jpg?t=1660673287",
      "url": "https://bit.ly/3YscbrT",
      "store": "Epic Games",
      "price": 5.00,
      "date": "17-12-2022",
      "id": "",
      "store2": "",
      "url2": "",
      "store3": "",
      "url3": "",
      "specialCode": "",
      "information": "",
      "instructions": "",
      "status": 2,
      "horizontal": true,
      "startDate": "2022-12-16T16:00:00.000Z",
      "endDate": "2022-12-17T16:00:00.000Z"
   },
   {
      "title": "Bloons TD 6",
      "image": "https://cdn1.epicgames.com/offer/d5241c76f178492ea1540fce45616757/Copyof15days-day1-wrapped-desktop-carousel-image_1920x1080-3bb888ab4e7b69f11b20548fd36e000a?h=480&resize=1&w=854",
      "url": "https://bit.ly/3WfKyjM",
      "store": "Epic Games",
      "price": 5.00,
      "date": "16-12-2022",
      "id": "",
      "store2": "",
      "url2": "",
      "store3": "",
      "url3": "",
      "specialCode": "",
      "information": "",
      "instructions": "",
      "status": 2,
      "horizontal": true,
      "startDate": "",
      "endDate": ""
   },
   {
      "title": "STAR WARS™: Squadrons",
      "image": "https://cdn1.epicgames.com/bc2b0372eaa448469cb9a769f27acea1/offer/wide-2560x1440-f09b204b4eb17f85e997a247901b8d81.jpg",
      "url": "https://bit.ly/3XaypxX",
      "store": "Epic Games",
      "price": 40.00,
      "date": "01-12-2022",
      "id": "",
      "horizontal": true,
      "status": 2,
      "store2": "",
      "url2": "",
      "store3": "",
      "url3": "",
      "specialCode": "",
      "information": "",
      "instructions": "",
      "startDate": "",
      "endDate": ""
   },
   {
      "id": "////SUB SCREEN////",
      "horizontal": false,
      "image": "https://image.api.playstation.com/vulcan/ap/rnd/202206/2707/rNZrAmBmEe1hBvfE5WC6JjcR.jpg",
      "url": "https://www.google.com",
      "title": "PUBG",
      "store": "",
      "price": 0.00,
      "date": "??-08-2022",
      "status": 2,
      "store2": "",
      "url2": "",
      "store3": "",
      "url3": "",
      "specialCode": "",
      "information": "",
      "instructions": "",
      "startDate": "",
      "endDate": ""
   },
   {
      "title": "ARK: Survival Evolved",
      "image": "https://cdn.akamai.steamstatic.com/steam/apps/346110/header.jpg?t=1655137924",
      "url": "https://bit.ly/3DuInD2",
      "store": "Epic Games",
      "price": 8.00,
      "date": "29-09-2022",
      "id": "",
      "horizontal": true,
      "status": 2,
      "store2": "",
      "url2": "",
      "store3": "",
      "url3": "",
      "specialCode": "",
      "information": "",
      "instructions": "",
      "startDate": "",
      "endDate": ""
   },
   {
      "title": "Shadow of the Tomb Raider: Definitive Edition",
      "image": "https://cdn.akamai.steamstatic.com/steam/apps/750920/header.jpg?t=1661268640",
      "url": "https://bit.ly/3R9d8kh",
      "store": "Epic Games",
      "price": 13.00,
      "date": "08-09-2022",
      "id": "",
      "horizontal": true,
      "status": 2,
      "store2": "",
      "url2": "",
      "store3": "",
      "url3": "",
      "specialCode": "",
      "information": "",
      "instructions": "",
      "startDate": "",
      "endDate": ""
   },
   {
      "id": "////SUB SCREEN////",
      "horizontal": false,
      "title": "Diablo Immortal",
      "image": "https://blz-contentstack-images.akamaized.net/v3/assets/blt77f4425de611b362/blt0b41183f11404532/61660a3ace267e66ae2fe854/di-opengraph_001.jpg",
      "url": "https://www.google.com",
      "store": "",
      "price": 0.00,
      "date": "??-08-2022",
      "status": 4,
      "store2": "",
      "url2": "",
      "store3": "",
      "url3": "",
      "specialCode": "",
      "information": "",
      "instructions": "",
      "startDate": "",
      "endDate": ""
   },
   {
      "title": "Borderlands 3",
      "image": "https://cdn1.epicgames.com/offer/d5241c76f178492ea1540fce45616757/egs-vault-w1-1920x1080_1920x1080-9bccac92ec0b41b294fc008cea5615c9?h=480&resize=1&w=854",
      "url": "https://bit.ly/3wsWapB",
      "store": "Epic Games",
      "price": 5.00,
      "date": "26-05-2022",
      "id": "",
      "horizontal": true,
      "status": 2,
      "store2": "",
      "url2": "",
      "store3": "",
      "url3": "",
      "specialCode": "",
      "information": "",
      "instructions": "",
      "startDate": "",
      "endDate": ""
   },
   {
      "id": "",
      "horizontal": true,
      "image": "https://cdn1.epicgames.com/salesEvent/salesEvent/EGS_Prey_ArkaneStudios_S3_2560x1440-66103490180b56a8a132ae2487e18f2f?h=480&resize=1&w=854",
      "url": "https://bit.ly/37mJtmq",
      "title": "Prey",
      "store": "Epic Games",
      "price": 40.00,
      "date": "19-05-2022",
      "status": 2,
      "store2": "",
      "url2": "",
      "store3": "",
      "url3": "",
      "specialCode": "",
      "information": "",
      "instructions": "",
      "startDate": "",
      "endDate": ""
   }
]